### ISSUE TITLE
docs: observe east-west gateway port 15443 traffic via tcpdump in kind clusters

### ISSUE THREAD

**Issue by benchen149** [benchen149/kind-create-cluster#27]
## Background

After fixing the multi-network label configuration (#25), cross-cluster traffic from c1 to c2 now correctly routes through the east-west gateway on port 15443. This issue documents how to verify this behavior using `tcpdump` in a kind environment.

## Traffic Flow

```
sleep (c1) → [mTLS] → c2 east-west gateway:15443 → helloworld-v2 (c2)
```

Since the destination is **c2's east-west gateway**, tcpdump must be run on the **c2 node**, not c1.

## Method 1: Install tcpdump on kind node

**Terminal 1 — install and start capture:**
```bash
docker exec c2-control-plane bash -c "apt-get update -qq && apt-get install -y tcpdump -qq"
docker exec -it c2-control-plane tcpdump -i any port 15443 -nn
```

**Terminal 2 — generate traffic:**
```bash
for i in $(seq 1 20); do
  kubectl --context kind-c1 exec -n istio-validation deploy/sleep -- \
    curl -s helloworld.istio-validation.svc.cluster.local:5000/hello
done
```

## Method 2: kubectl debug node (no installation required)

```bash
kubectl --context kind-c2 debug node/c2-control-plane \
  -it --image=nicolaka/netshoot \
  -- tcpdump -i any port 15443 -nn
```

## Expected Output

```
IP 172.18.10.x.xxxxx > 172.18.0.x.15443: Flags [S]    ← SYN from c1 pod
IP 172.18.0.x.15443 > 172.18.10.x.xxxxx: Flags [S.]   ← SYN-ACK from c2 ewgw
IP 172.18.10.x.xxxxx > 172.18.0.x.15443: Flags [.]    ← ACK (TLS handshake)
```

## Observation Checklist

| Item | Expected |
|---|---|
| Source IP | `172.18.10.x` (c1 pod subnet) |
| Destination IP:port | `172.18.0.x:15443` (c2 east-west gateway LoadBalancer IP) |
| TCP flags | `[S]` / `[S.]` — TLS handshake |
| tcpdump on c1 node | No 15443 packets (traffic originates from c1 pod, not c1 node) |

## Confirming via Envoy Cluster Stats (no tcpdump needed)

```bash
kubectl --context kind-c1 exec -n istio-validation deploy/sleep -c istio-proxy -- \
  curl -s localhost:15000/clusters | grep helloworld | grep -oE '[0-9]+\.[0-9]+\.[0-9]+\.[0-9]+:[0-9]+' | sort -u
```

Expected output shows `<ewgw-ip>:15443` alongside `<local-pod-ip>:5000`, confirming c2 traffic routes through east-west gateway.
